{
  "id": "01a0c450-6c00-700b-8000-000000015445",
  "kind": "translations",
  "locale": "am-ET",
  "messages": {
    "01a0c450-6c00-7002-8000-000000003dde": "የብድር ማስያ",
    "01a0c450-6c00-7003-8000-000000005ccd": "መጠን",
    "01a0c450-6c00-7004-8000-000000007bbc": "ጊዜ በወራት",
    "01a0c450-6c00-7005-8000-000000009aab": "አስላ",
    "01a0c450-6c00-7006-8000-00000000b99a": "የክፍያ ዕቅድዎ",
    "01a0c450-6c00-7007-8000-00000000d889": "ወርሃዊ ክፍያ",
    "01a0c450-6c00-7008-8000-00000000f778": "Plux Demo"
  },
  "schemaVersion": "1.0.0"
}
